[
  {
    "evidence_id": "10_1016_j_cirpj_2024_06_009-octet-10x10x10-d0p40-r015-ev-001",
    "sample_id": "10_1016_j_cirpj_2024_06_009-octet-10x10x10-d0p40-r015",
    "field_name": "raw_structure",
    "field_value": "Octet",
    "source_priority": "T1",
    "source_type": "text",
    "page_no": 1,
    "figure_id": null,
    "table_id": null,
    "text_snippet": "The paper systematically compares FCC, Octet, and Kelvin lattice structures fabricated by LPBF.",
    "extractor": "build_pdf_sample_bundle",
    "extract_confidence": 0.99,
    "verified_by_human": false
  },
  {
    "evidence_id": "10_1016_j_cirpj_2024_06_009-octet-10x10x10-d0p40-r015-ev-002",
    "sample_id": "10_1016_j_cirpj_2024_06_009-octet-10x10x10-d0p40-r015",
    "field_name": "raw_design",
    "field_value": "10 × 10 × 10 mm, 0.40 mm strut diameter",
    "source_priority": "T1",
    "source_type": "table",
    "page_no": 3,
    "figure_id": null,
    "table_id": "table_001",
    "text_snippet": "Table 1 records the Octet lattice structure with length, width, and height of 10 mm and a strut diameter of 0.40 mm.",
    "extractor": "build_pdf_sample_bundle",
    "extract_confidence": 0.99,
    "verified_by_human": false
  },
  {
    "evidence_id": "10_1016_j_cirpj_2024_06_009-octet-10x10x10-d0p40-r015-ev-003",
    "sample_id": "10_1016_j_cirpj_2024_06_009-octet-10x10x10-d0p40-r015",
    "field_name": "raw_material",
    "field_value": "316L stainless steel",
    "source_priority": "T1",
    "source_type": "text",
    "page_no": 2,
    "figure_id": null,
    "table_id": null,
    "text_snippet": "316 L stainless steel was selected as the basic material for the lattice structures.",
    "extractor": "build_pdf_sample_bundle",
    "extract_confidence": 0.99,
    "verified_by_human": false
  },
  {
    "evidence_id": "10_1016_j_cirpj_2024_06_009-octet-10x10x10-d0p40-r015-ev-004",
    "sample_id": "10_1016_j_cirpj_2024_06_009-octet-10x10x10-d0p40-r015",
    "field_name": "raw_process",
    "field_value": "LPBF",
    "source_priority": "T1",
    "source_type": "text",
    "page_no": 2,
    "figure_id": null,
    "table_id": null,
    "text_snippet": "FCC, Octet, and Kelvin lattice structures were fabricated using the LPBF technology.",
    "extractor": "build_pdf_sample_bundle",
    "extract_confidence": 0.99,
    "verified_by_human": false
  },
  {
    "evidence_id": "10_1016_j_cirpj_2024_06_009-octet-10x10x10-d0p40-r015-ev-005",
    "sample_id": "10_1016_j_cirpj_2024_06_009-octet-10x10x10-d0p40-r015",
    "field_name": "relative_density_raw",
    "field_value": "15 %",
    "source_priority": "T1",
    "source_type": "text",
    "page_no": 3,
    "figure_id": null,
    "table_id": null,
    "text_snippet": "All lattice structures have the same relative density ρ (15 %) to study the effect of geometries on formability and mechanical properties.",
    "extractor": "build_pdf_sample_bundle",
    "extract_confidence": 0.98,
    "verified_by_human": false
  },
  {
    "evidence_id": "10_1016_j_cirpj_2024_06_009-octet-10x10x10-d0p40-r015-ev-006",
    "sample_id": "10_1016_j_cirpj_2024_06_009-octet-10x10x10-d0p40-r015",
    "field_name": "sea_j_g",
    "field_value": "18.1 J/g",
    "source_priority": "T1",
    "source_type": "text",
    "page_no": 7,
    "figure_id": null,
    "table_id": null,
    "text_snippet": "When the strain reached 50 %, the W s of FCC, Octet, and Kelvin lattice structures were 31.9 J/g, 18.1 J/g, and 25.3 J/g, respectively.",
    "extractor": "build_pdf_sample_bundle",
    "extract_confidence": 0.99,
    "verified_by_human": false
  }
]
