[
  {
    "evidence_id": "10_1016_j_matdes_2017_10_028-rd016-hierarchical-honeycomb-ev-001",
    "sample_id": "10_1016_j_matdes_2017_10_028-rd016-hierarchical-honeycomb",
    "field_name": "raw_structure",
    "field_value": "hierarchical honeycomb",
    "source_priority": "T1",
    "source_type": "text",
    "page_no": 1,
    "figure_id": null,
    "table_id": null,
    "text_snippet": "Abstract describes a hierarchical cellular structure formed by replacing honeycomb cell walls with triangular lattice configurations.",
    "extractor": "build_pdf_sample_bundle",
    "extract_confidence": 1.0,
    "verified_by_human": false
  },
  {
    "evidence_id": "10_1016_j_matdes_2017_10_028-rd016-hierarchical-honeycomb-ev-002",
    "sample_id": "10_1016_j_matdes_2017_10_028-rd016-hierarchical-honeycomb",
    "field_name": "raw_design",
    "field_value": "gamma=1/5, N=2",
    "source_priority": "T1",
    "source_type": "text",
    "page_no": 2,
    "figure_id": null,
    "table_id": null,
    "text_snippet": "In view of printer resolution and platen size, gamma = 1/5 and N = 2 were chosen for the prototypes.",
    "extractor": "build_pdf_sample_bundle",
    "extract_confidence": 0.99,
    "verified_by_human": false
  },
  {
    "evidence_id": "10_1016_j_matdes_2017_10_028-rd016-hierarchical-honeycomb-ev-003",
    "sample_id": "10_1016_j_matdes_2017_10_028-rd016-hierarchical-honeycomb",
    "field_name": "raw_material",
    "field_value": "VeroWhite",
    "source_priority": "T1",
    "source_type": "text",
    "page_no": 2,
    "figure_id": null,
    "table_id": null,
    "text_snippet": "All samples were printed on an Objet Connex260 multi-material 3D printer using VeroWhite as the constitutive material.",
    "extractor": "build_pdf_sample_bundle",
    "extract_confidence": 0.99,
    "verified_by_human": false
  },
  {
    "evidence_id": "10_1016_j_matdes_2017_10_028-rd016-hierarchical-honeycomb-ev-004",
    "sample_id": "10_1016_j_matdes_2017_10_028-rd016-hierarchical-honeycomb",
    "field_name": "raw_process",
    "field_value": "3D printing",
    "source_priority": "T1",
    "source_type": "text",
    "page_no": 2,
    "figure_id": null,
    "table_id": null,
    "text_snippet": "The study fabricates the samples by 3D printing on an Objet Connex260 multi-material printer.",
    "extractor": "build_pdf_sample_bundle",
    "extract_confidence": 0.98,
    "verified_by_human": false
  },
  {
    "evidence_id": "10_1016_j_matdes_2017_10_028-rd016-hierarchical-honeycomb-ev-005",
    "sample_id": "10_1016_j_matdes_2017_10_028-rd016-hierarchical-honeycomb",
    "field_name": "relative_density",
    "field_value": "0.16",
    "source_priority": "T1",
    "source_type": "text",
    "page_no": 3,
    "figure_id": null,
    "table_id": null,
    "text_snippet": "Hierarchical honeycombs with relative densities of 0.16, 0.32 and 0.55 were fabricated for testing.",
    "extractor": "build_pdf_sample_bundle",
    "extract_confidence": 0.99,
    "verified_by_human": false
  }
]
