[
  {
    "evidence_id": "10_1016_j_matdes_2018_05_059-octagonal-l4p14-d1p626-r015-ev-001",
    "sample_id": "10_1016_j_matdes_2018_05_059-octagonal-l4p14-d1p626-r015",
    "field_name": "raw_structure",
    "field_value": "Octagonal",
    "source_priority": "T1",
    "source_type": "text",
    "page_no": 4,
    "figure_id": null,
    "table_id": null,
    "text_snippet": "Thus type 2 was constructed from three crossed octagons, designated as Octagonal lattice.",
    "extractor": "build_pdf_sample_bundle",
    "extract_confidence": 0.99,
    "verified_by_human": false
  },
  {
    "evidence_id": "10_1016_j_matdes_2018_05_059-octagonal-l4p14-d1p626-r015-ev-002",
    "sample_id": "10_1016_j_matdes_2018_05_059-octagonal-l4p14-d1p626-r015",
    "field_name": "raw_design",
    "field_value": "5 x 5 x 5 cells, octagonal lattice, l = 4.14 mm, d = 1.626 mm",
    "source_priority": "T1",
    "source_type": "table",
    "page_no": 2,
    "figure_id": null,
    "table_id": "table_001",
    "text_snippet": "Table 1 Unit cell and overall specimen design and dimensions for the examined 3D structures of 15% relative density. ... 2 Octagonal l =4.14 1.626 51.626",
    "extractor": "build_pdf_sample_bundle",
    "extract_confidence": 0.99,
    "verified_by_human": false
  },
  {
    "evidence_id": "10_1016_j_matdes_2018_05_059-octagonal-l4p14-d1p626-r015-ev-003",
    "sample_id": "10_1016_j_matdes_2018_05_059-octagonal-l4p14-d1p626-r015",
    "field_name": "raw_material",
    "field_value": "HP PA12",
    "source_priority": "T1",
    "source_type": "text",
    "page_no": 5,
    "figure_id": null,
    "table_id": null,
    "text_snippet": "A prototype of each lattice type was built using a new 3D printing technology called Multi Jet Fusion (MJF) in a brand of polyamide 12 plastic, namely HP PA12 available for this process.",
    "extractor": "build_pdf_sample_bundle",
    "extract_confidence": 0.99,
    "verified_by_human": false
  },
  {
    "evidence_id": "10_1016_j_matdes_2018_05_059-octagonal-l4p14-d1p626-r015-ev-004",
    "sample_id": "10_1016_j_matdes_2018_05_059-octagonal-l4p14-d1p626-r015",
    "field_name": "raw_process",
    "field_value": "MJF",
    "source_priority": "T1",
    "source_type": "text",
    "page_no": 5,
    "figure_id": null,
    "table_id": null,
    "text_snippet": "A prototype of each lattice type was built using a new 3D printing technology called Multi Jet Fusion (MJF) in a brand of polyamide 12 plastic, namely HP PA12 available for this process.",
    "extractor": "build_pdf_sample_bundle",
    "extract_confidence": 0.99,
    "verified_by_human": false
  },
  {
    "evidence_id": "10_1016_j_matdes_2018_05_059-octagonal-l4p14-d1p626-r015-ev-005",
    "sample_id": "10_1016_j_matdes_2018_05_059-octagonal-l4p14-d1p626-r015",
    "field_name": "relative_density_raw",
    "field_value": "15 %",
    "source_priority": "T1",
    "source_type": "table",
    "page_no": 2,
    "figure_id": null,
    "table_id": "table_001",
    "text_snippet": "The six structures were designed to have a constant relative density of 15%.",
    "extractor": "build_pdf_sample_bundle",
    "extract_confidence": 0.98,
    "verified_by_human": false
  },
  {
    "evidence_id": "10_1016_j_matdes_2018_05_059-octagonal-l4p14-d1p626-r015-ev-006",
    "sample_id": "10_1016_j_matdes_2018_05_059-octagonal-l4p14-d1p626-r015",
    "field_name": "velocity_m_s_raw",
    "field_value": "5 mm/min",
    "source_priority": "T1",
    "source_type": "text",
    "page_no": 10,
    "figure_id": null,
    "table_id": null,
    "text_snippet": "The cross-head was moving downwards at a constant speed of 5 mm/min in accordance with the standard test method for compressive properties of rigid cellular plastics ASTM 1621-16.",
    "extractor": "build_pdf_sample_bundle",
    "extract_confidence": 0.99,
    "verified_by_human": false
  },
  {
    "evidence_id": "10_1016_j_matdes_2018_05_059-octagonal-l4p14-d1p626-r015-ev-007",
    "sample_id": "10_1016_j_matdes_2018_05_059-octagonal-l4p14-d1p626-r015",
    "field_name": "sea_j_g",
    "field_value": "0.75 J/cm3",
    "source_priority": "T1",
    "source_type": "text",
    "page_no": 9,
    "figure_id": null,
    "table_id": null,
    "text_snippet": "From the table, it can be seen that the Octagonal lattice is capable of absorbing the highest energy of 0.75 J/cm 3.",
    "extractor": "build_pdf_sample_bundle",
    "extract_confidence": 0.99,
    "verified_by_human": false
  },
  {
    "evidence_id": "10_1016_j_matdes_2018_05_059-octagonal-l4p14-d1p626-r015-ev-008",
    "sample_id": "10_1016_j_matdes_2018_05_059-octagonal-l4p14-d1p626-r015",
    "field_name": "plateau_stress_mpa",
    "field_value": "1.05 MPa",
    "source_priority": "T1",
    "source_type": "text",
    "page_no": 9,
    "figure_id": null,
    "table_id": null,
    "text_snippet": "Among all structures, the Octagonal lattice provides the highest plateau stress of 1.05 MPa.",
    "extractor": "build_pdf_sample_bundle",
    "extract_confidence": 0.99,
    "verified_by_human": false
  }
]
