[
  {
    "evidence_id": "10_1016_j_compstruct_2018_03_050-n2-r0125-triangular-hierarchical-ev-001",
    "sample_id": "10_1016_j_compstruct_2018_03_050-n2-r0125-triangular-hierarchical",
    "field_name": "raw_structure",
    "field_value": "triangular hierarchical honeycomb",
    "source_priority": "T1",
    "source_type": "text",
    "page_no": 11,
    "figure_id": null,
    "table_id": null,
    "text_snippet": "The triangular hierarchical honeycomb with N = 2 and r = 1/8 has the highest crushing resistance performance, with over twice the value of absorbed energy compared to the regular honeycomb.",
    "extractor": "build_pdf_sample_bundle",
    "extract_confidence": 1.0,
    "verified_by_human": false
  },
  {
    "evidence_id": "10_1016_j_compstruct_2018_03_050-n2-r0125-triangular-hierarchical-ev-002",
    "sample_id": "10_1016_j_compstruct_2018_03_050-n2-r0125-triangular-hierarchical",
    "field_name": "raw_design",
    "field_value": "N=2, r=1/8",
    "source_priority": "T1",
    "source_type": "text",
    "page_no": 9,
    "figure_id": null,
    "table_id": null,
    "text_snippet": "Fig. 21 shows the effect of geometric parameters on the mean crushing force of the triangular hierarchical honeycomb. The triangular hierarchical honeycomb with N = 2 and r = 1/8 features the highest mean crushing force.",
    "extractor": "build_pdf_sample_bundle",
    "extract_confidence": 0.99,
    "verified_by_human": false
  },
  {
    "evidence_id": "10_1016_j_compstruct_2018_03_050-n2-r0125-triangular-hierarchical-ev-003",
    "sample_id": "10_1016_j_compstruct_2018_03_050-n2-r0125-triangular-hierarchical",
    "field_name": "raw_material",
    "field_value": "AA3030-H19",
    "source_priority": "T1",
    "source_type": "text",
    "page_no": 2,
    "figure_id": null,
    "table_id": null,
    "text_snippet": "The hierarchical honeycombs are made of aluminum alloy AA3030-H19, Young's modulus E = 69 GPa, Poisson's ratio v = 0.33, density 2700 kg/m3, yield strength 115.8 MPa and ultimate tensile stress 160 MPa.",
    "extractor": "build_pdf_sample_bundle",
    "extract_confidence": 0.99,
    "verified_by_human": false
  },
  {
    "evidence_id": "10_1016_j_compstruct_2018_03_050-n2-r0125-triangular-hierarchical-ev-004",
    "sample_id": "10_1016_j_compstruct_2018_03_050-n2-r0125-triangular-hierarchical",
    "field_name": "raw_process",
    "field_value": "LS-DYNA",
    "source_priority": "T1",
    "source_type": "text",
    "page_no": 2,
    "figure_id": null,
    "table_id": null,
    "text_snippet": "The finite element model consists of three parts: two rigid plates and the hierarchical honeycomb confined within those plates. The hierarchical honeycombs are discretized using shell elements, while the remaining two plates are meshed with hexahedral elements in LS-DYNA.",
    "extractor": "build_pdf_sample_bundle",
    "extract_confidence": 0.98,
    "verified_by_human": false
  },
  {
    "evidence_id": "10_1016_j_compstruct_2018_03_050-n2-r0125-triangular-hierarchical-ev-005",
    "sample_id": "10_1016_j_compstruct_2018_03_050-n2-r0125-triangular-hierarchical",
    "field_name": "relative_density",
    "field_value": "0.05",
    "source_priority": "T1",
    "source_type": "text",
    "page_no": 2,
    "figure_id": null,
    "table_id": null,
    "text_snippet": "The simulations carried out in this work have been performed by fixing l0 = 20 mm, t0 = 0.8 mm, and an out-of-plane thickness of 10 mm. As a result, the relative density for all of the considered honeycombs is 0.05.",
    "extractor": "build_pdf_sample_bundle",
    "extract_confidence": 0.99,
    "verified_by_human": false
  }
]
