[
  {
    "evidence_id": "10_1016_j_engstruct_2023_116510-knee-b7p71-d2p00-ev-001",
    "sample_id": "10_1016_j_engstruct_2023_116510-knee-b7p71-d2p00",
    "field_name": "raw_structure",
    "field_value": "hollow rhombic dodecahedron and six cylindrical tubes",
    "source_priority": "T1",
    "source_type": "text",
    "page_no": 1,
    "figure_id": null,
    "table_id": null,
    "text_snippet": "This work investigates the vibration isolation performance and crashworthiness of a novel three-dimensional (3D) lattice metamaterial, whose unit cell is constructed by combining a hollow rhombic dodecahedron and six cylindrical tubes.",
    "extractor": "build_pdf_sample_bundle",
    "extract_confidence": 0.99,
    "verified_by_human": false
  },
  {
    "evidence_id": "10_1016_j_engstruct_2023_116510-knee-b7p71-d2p00-ev-002",
    "sample_id": "10_1016_j_engstruct_2023_116510-knee-b7p71-d2p00",
    "field_name": "raw_material",
    "field_value": "316L stainless steel",
    "source_priority": "T1",
    "source_type": "table",
    "page_no": 2,
    "figure_id": null,
    "table_id": "table_001",
    "text_snippet": "Table 1 Material properties of the 316L stainless steel.",
    "extractor": "build_pdf_sample_bundle",
    "extract_confidence": 0.99,
    "verified_by_human": false
  },
  {
    "evidence_id": "10_1016_j_engstruct_2023_116510-knee-b7p71-d2p00-ev-003",
    "sample_id": "10_1016_j_engstruct_2023_116510-knee-b7p71-d2p00",
    "field_name": "raw_process",
    "field_value": "COMSOL Multiphysics / LS-DYNA",
    "source_priority": "T1",
    "source_type": "text",
    "page_no": 3,
    "figure_id": null,
    "table_id": null,
    "text_snippet": "COMSOL Multiphysics is employed to calculate the band structures. A constant impact velocity of 15 m/s is applied to the loaded plane. The numerical model of the 3D metamaterial for crushing analysis is established using the finite element (FE) code LS-DYNA.",
    "extractor": "build_pdf_sample_bundle",
    "extract_confidence": 0.98,
    "verified_by_human": false
  },
  {
    "evidence_id": "10_1016_j_engstruct_2023_116510-knee-b7p71-d2p00-ev-004",
    "sample_id": "10_1016_j_engstruct_2023_116510-knee-b7p71-d2p00",
    "field_name": "raw_design",
    "field_value": "b=7.71 mm, d=2.00 mm",
    "source_priority": "T1",
    "source_type": "table",
    "page_no": 10,
    "figure_id": null,
    "table_id": "table_003",
    "text_snippet": "Table 3 Optimal design of the 3D metamaterial with F max = 500kN. b (mm) d (mm) GR SEA (kJ/kg) PCF (kN) FE. RBF. RE (%) FE. RBF. RE (%) FE. RBF. RE (%) 7.71 2.00 0.4745 0.4842 2.04 23.66 23.80 0.59 461.54 452.32 2.00",
    "extractor": "build_pdf_sample_bundle",
    "extract_confidence": 0.99,
    "verified_by_human": false
  },
  {
    "evidence_id": "10_1016_j_engstruct_2023_116510-knee-b7p71-d2p00-ev-005",
    "sample_id": "10_1016_j_engstruct_2023_116510-knee-b7p71-d2p00",
    "field_name": "sea_j_g",
    "field_value": "23.66",
    "source_priority": "T1",
    "source_type": "table",
    "page_no": 10,
    "figure_id": null,
    "table_id": "table_003",
    "text_snippet": "Table 3 Optimal design of the 3D metamaterial with F max = 500kN.",
    "extractor": "build_pdf_sample_bundle",
    "extract_confidence": 0.99,
    "verified_by_human": false
  },
  {
    "evidence_id": "10_1016_j_engstruct_2023_116510-knee-b7p71-d2p00-ev-006",
    "sample_id": "10_1016_j_engstruct_2023_116510-knee-b7p71-d2p00",
    "field_name": "pcf_kn",
    "field_value": "461.54",
    "source_priority": "T1",
    "source_type": "table",
    "page_no": 10,
    "figure_id": null,
    "table_id": "table_003",
    "text_snippet": "Table 3 Optimal design of the 3D metamaterial with F max = 500kN.",
    "extractor": "build_pdf_sample_bundle",
    "extract_confidence": 0.99,
    "verified_by_human": false
  }
]
