[
  {
    "evidence_id": "10_3390_ma18040732-bccz-cross-4x4x5-ev-001",
    "sample_id": "10_3390_ma18040732-bccz-cross-4x4x5",
    "field_name": "raw_structure",
    "field_value": "BCCz+cross",
    "source_priority": "T1",
    "source_type": "text",
    "page_no": 4,
    "figure_id": null,
    "table_id": null,
    "text_snippet": "If a BCC structure is reinforced with vertical and rectangular and cross-shaped horizontal struts, it is denominated as BCCz+rect and BCCz+cross, respectively.",
    "extractor": "build_pdf_sample_bundle",
    "extract_confidence": 0.99,
    "verified_by_human": false
  },
  {
    "evidence_id": "10_3390_ma18040732-bccz-cross-4x4x5-ev-002",
    "sample_id": "10_3390_ma18040732-bccz-cross-4x4x5",
    "field_name": "raw_design",
    "field_value": "4 × 4 × 5 lattice structure, 12 mm unit cell",
    "source_priority": "T1",
    "source_type": "text",
    "page_no": 18,
    "figure_id": null,
    "table_id": null,
    "text_snippet": "For the fabrication process, six structures were output, each with a length of one corner of the unit structure set to 12 mm, consistent with the dimensions used in the FEA models. The overall size of the fabricated structure was 48 mm × 48 mm × 60 mm, with the number of unit structures in each corner set to 4, 4, and 5, respectively.",
    "extractor": "build_pdf_sample_bundle",
    "extract_confidence": 0.98,
    "verified_by_human": false
  },
  {
    "evidence_id": "10_3390_ma18040732-bccz-cross-4x4x5-ev-003",
    "sample_id": "10_3390_ma18040732-bccz-cross-4x4x5",
    "field_name": "raw_material",
    "field_value": "Ti-6Al-4V Grade 5",
    "source_priority": "T1",
    "source_type": "text",
    "page_no": 18,
    "figure_id": null,
    "table_id": null,
    "text_snippet": "Ti-6Al-4V Grade 5 metal powder was employed, possessing an average particle size ranging from 45 to 106 µm.",
    "extractor": "build_pdf_sample_bundle",
    "extract_confidence": 0.99,
    "verified_by_human": false
  },
  {
    "evidence_id": "10_3390_ma18040732-bccz-cross-4x4x5-ev-004",
    "sample_id": "10_3390_ma18040732-bccz-cross-4x4x5",
    "field_name": "raw_process",
    "field_value": "EBM",
    "source_priority": "T1",
    "source_type": "text",
    "page_no": 18,
    "figure_id": null,
    "table_id": null,
    "text_snippet": "The structures were manufactured by the EBM method with the GE Additive's Arcam EBM Spectra H Machine.",
    "extractor": "build_pdf_sample_bundle",
    "extract_confidence": 0.99,
    "verified_by_human": false
  },
  {
    "evidence_id": "10_3390_ma18040732-bccz-cross-4x4x5-ev-005",
    "sample_id": "10_3390_ma18040732-bccz-cross-4x4x5",
    "field_name": "sea_j_g",
    "field_value": "2.68 × 10^3",
    "source_priority": "T1",
    "source_type": "table",
    "page_no": 21,
    "figure_id": null,
    "table_id": "table_002",
    "text_snippet": "BCCz+cross 8.4 2.25 × 10^4 2.68 × 10^3 4.68 × 10^2 0.3424 55.77",
    "extractor": "build_pdf_sample_bundle",
    "extract_confidence": 0.99,
    "verified_by_human": false
  },
  {
    "evidence_id": "10_3390_ma18040732-bccz-cross-4x4x5-ev-006",
    "sample_id": "10_3390_ma18040732-bccz-cross-4x4x5",
    "field_name": "mcf_kn",
    "field_value": "4.68 × 10^2",
    "source_priority": "T1",
    "source_type": "table",
    "page_no": 21,
    "figure_id": null,
    "table_id": "table_002",
    "text_snippet": "BCCz+cross 8.4 2.25 × 10^4 2.68 × 10^3 4.68 × 10^2 0.3424 55.77",
    "extractor": "build_pdf_sample_bundle",
    "extract_confidence": 0.99,
    "verified_by_human": false
  }
]
