[
  {
    "evidence_id": "10_1016_j_ijimpeng_2023_104713-design1-reinforced-hexagonal-lattice-ev-001",
    "sample_id": "10_1016_j_ijimpeng_2023_104713-design1-reinforced-hexagonal-lattice",
    "field_name": "raw_structure",
    "field_value": "reinforced hexagonal lattice",
    "source_priority": "T1",
    "source_type": "text",
    "page_no": 1,
    "figure_id": null,
    "table_id": null,
    "text_snippet": "A spatial lattice structure is proposed via a bionic honeycomb and the single-cell structure is arrayed into a spatial lattice structure.",
    "extractor": "build_pdf_sample_bundle",
    "extract_confidence": 0.99,
    "verified_by_human": false
  },
  {
    "evidence_id": "10_1016_j_ijimpeng_2023_104713-design1-reinforced-hexagonal-lattice-ev-002",
    "sample_id": "10_1016_j_ijimpeng_2023_104713-design1-reinforced-hexagonal-lattice",
    "field_name": "raw_design",
    "field_value": "L=8, I=9, J=1.8, theta=119, T=2, nx=4, ny=5, nz=8",
    "source_priority": "T1",
    "source_type": "table",
    "page_no": 13,
    "figure_id": null,
    "table_id": "table_009",
    "text_snippet": "Table 9 lists the optimal structure parameters L=8, I=9, J=1.8, theta=119, T=2, nx=4, ny=5, nz=8.",
    "extractor": "build_pdf_sample_bundle",
    "extract_confidence": 0.99,
    "verified_by_human": false
  },
  {
    "evidence_id": "10_1016_j_ijimpeng_2023_104713-design1-reinforced-hexagonal-lattice-ev-003",
    "sample_id": "10_1016_j_ijimpeng_2023_104713-design1-reinforced-hexagonal-lattice",
    "field_name": "raw_material",
    "field_value": "AA6061-T6",
    "source_priority": "T1",
    "source_type": "text",
    "page_no": 3,
    "figure_id": null,
    "table_id": null,
    "text_snippet": "The material of the lattice structure is AA6061-T6 aluminum alloy.",
    "extractor": "build_pdf_sample_bundle",
    "extract_confidence": 0.99,
    "verified_by_human": false
  },
  {
    "evidence_id": "10_1016_j_ijimpeng_2023_104713-design1-reinforced-hexagonal-lattice-ev-004",
    "sample_id": "10_1016_j_ijimpeng_2023_104713-design1-reinforced-hexagonal-lattice",
    "field_name": "raw_process",
    "field_value": "LS-DYNA",
    "source_priority": "T1",
    "source_type": "text",
    "page_no": 4,
    "figure_id": null,
    "table_id": null,
    "text_snippet": "LS-DYNA software is used as the solver for finite element analysis (FEA).",
    "extractor": "build_pdf_sample_bundle",
    "extract_confidence": 0.98,
    "verified_by_human": false
  },
  {
    "evidence_id": "10_1016_j_ijimpeng_2023_104713-design1-reinforced-hexagonal-lattice-ev-005",
    "sample_id": "10_1016_j_ijimpeng_2023_104713-design1-reinforced-hexagonal-lattice",
    "field_name": "sea_j_g",
    "field_value": "24.445",
    "source_priority": "T1",
    "source_type": "table",
    "page_no": 12,
    "figure_id": null,
    "table_id": "table_008",
    "text_snippet": "Table 8 shows the GRA and EW optimal design with PF 58.519 kN and SEA 24.445 kJ/kg.",
    "extractor": "build_pdf_sample_bundle",
    "extract_confidence": 0.99,
    "verified_by_human": false
  },
  {
    "evidence_id": "10_1016_j_ijimpeng_2023_104713-design1-reinforced-hexagonal-lattice-ev-006",
    "sample_id": "10_1016_j_ijimpeng_2023_104713-design1-reinforced-hexagonal-lattice",
    "field_name": "pcf_kn",
    "field_value": "58.519",
    "source_priority": "T1",
    "source_type": "table",
    "page_no": 12,
    "figure_id": null,
    "table_id": "table_008",
    "text_snippet": "Table 8 shows the GRA and EW optimal design with PF 58.519 kN and SEA 24.445 kJ/kg.",
    "extractor": "build_pdf_sample_bundle",
    "extract_confidence": 0.99,
    "verified_by_human": false
  }
]
