[
  {
    "evidence_id": "10_1016_j_ijimpeng_2025_105321-hprl-qstatic-r022-ev-001",
    "sample_id": "10_1016_j_ijimpeng_2025_105321-hprl-qstatic-r022",
    "field_name": "raw_structure",
    "field_value": "HPRL",
    "source_priority": "T1",
    "source_type": "text",
    "page_no": 2,
    "figure_id": null,
    "table_id": null,
    "text_snippet": "The hybrid structure is established by combining a semi-open Octet-plate lattice (SOPL) and a strut or rod-based open-cell lattice, to form a hybrid plate-rod lattice (HPRL), amenable to fabrication via selective laser melting (SLM).",
    "extractor": "build_pdf_sample_bundle",
    "extract_confidence": 0.99,
    "verified_by_human": false
  },
  {
    "evidence_id": "10_1016_j_ijimpeng_2025_105321-hprl-qstatic-r022-ev-002",
    "sample_id": "10_1016_j_ijimpeng_2025_105321-hprl-qstatic-r022",
    "field_name": "raw_design",
    "field_value": "4 × 4 × 4 cell assembly, 24 mm cube",
    "source_priority": "T1",
    "source_type": "text",
    "page_no": 2,
    "figure_id": null,
    "table_id": null,
    "text_snippet": "Using SolidWorks software, 4 × 4 × 4 cell assemblies of the semi-open Octet-plate lattice (SOPL) and hybrid plate-rod lattice (HPRL) were established by connecting four unit cells along three orthogonal directions.",
    "extractor": "build_pdf_sample_bundle",
    "extract_confidence": 0.98,
    "verified_by_human": false
  },
  {
    "evidence_id": "10_1016_j_ijimpeng_2025_105321-hprl-qstatic-r022-ev-003",
    "sample_id": "10_1016_j_ijimpeng_2025_105321-hprl-qstatic-r022",
    "field_name": "raw_material",
    "field_value": "17-4PH stainless steel",
    "source_priority": "T1",
    "source_type": "text",
    "page_no": 2,
    "figure_id": null,
    "table_id": null,
    "text_snippet": "17 -4PH stainless steel powder was used to fabricate HPRL specimens by selective laser melting (SLM).",
    "extractor": "build_pdf_sample_bundle",
    "extract_confidence": 0.99,
    "verified_by_human": false
  },
  {
    "evidence_id": "10_1016_j_ijimpeng_2025_105321-hprl-qstatic-r022-ev-004",
    "sample_id": "10_1016_j_ijimpeng_2025_105321-hprl-qstatic-r022",
    "field_name": "raw_process",
    "field_value": "SLM",
    "source_priority": "T1",
    "source_type": "text",
    "page_no": 2,
    "figure_id": null,
    "table_id": null,
    "text_snippet": "17 -4PH stainless steel powder was used to fabricate HPRL specimens by selective laser melting (SLM).",
    "extractor": "build_pdf_sample_bundle",
    "extract_confidence": 0.99,
    "verified_by_human": false
  },
  {
    "evidence_id": "10_1016_j_ijimpeng_2025_105321-hprl-qstatic-r022-ev-005",
    "sample_id": "10_1016_j_ijimpeng_2025_105321-hprl-qstatic-r022",
    "field_name": "velocity_m_s_raw",
    "field_value": "0.024 mm/s",
    "source_priority": "T1",
    "source_type": "table",
    "page_no": 4,
    "figure_id": null,
    "table_id": "table_002",
    "text_snippet": "HPRL 1 24.03 × 24.08 × 24.03 mm 3 23.91 g 0.024 mm/ s 0.22",
    "extractor": "build_pdf_sample_bundle",
    "extract_confidence": 0.98,
    "verified_by_human": false
  },
  {
    "evidence_id": "10_1016_j_ijimpeng_2025_105321-hprl-qstatic-r022-ev-006",
    "sample_id": "10_1016_j_ijimpeng_2025_105321-hprl-qstatic-r022",
    "field_name": "relative_density_raw",
    "field_value": "0.22",
    "source_priority": "T1",
    "source_type": "table",
    "page_no": 4,
    "figure_id": null,
    "table_id": "table_002",
    "text_snippet": "HPRL 1 24.03 × 24.08 × 24.03 mm 3 23.91 g 0.024 mm/ s 0.22",
    "extractor": "build_pdf_sample_bundle",
    "extract_confidence": 0.98,
    "verified_by_human": false
  },
  {
    "evidence_id": "10_1016_j_ijimpeng_2025_105321-hprl-qstatic-r022-ev-007",
    "sample_id": "10_1016_j_ijimpeng_2025_105321-hprl-qstatic-r022",
    "field_name": "sea_j_g",
    "field_value": "11.2 J/g",
    "source_priority": "T1",
    "source_type": "table",
    "page_no": 9,
    "figure_id": null,
    "table_id": "table_003",
    "text_snippet": "HPRL Initial yield stress (MPa) 35.5 53.8 54.3 Densification strain 0.50 0.50 0.51 Average plateau stress (MPa) 38.7 45.7 46.6 SEA (J/g) 11.2 13.4 13.7",
    "extractor": "build_pdf_sample_bundle",
    "extract_confidence": 0.99,
    "verified_by_human": false
  },
  {
    "evidence_id": "10_1016_j_ijimpeng_2025_105321-hprl-qstatic-r022-ev-008",
    "sample_id": "10_1016_j_ijimpeng_2025_105321-hprl-qstatic-r022",
    "field_name": "plateau_stress_mpa",
    "field_value": "38.7 MPa",
    "source_priority": "T1",
    "source_type": "table",
    "page_no": 9,
    "figure_id": null,
    "table_id": "table_003",
    "text_snippet": "HPRL Initial yield stress (MPa) 35.5 53.8 54.3 Densification strain 0.50 0.50 0.51 Average plateau stress (MPa) 38.7 45.7 46.6 SEA (J/g) 11.2 13.4 13.7",
    "extractor": "build_pdf_sample_bundle",
    "extract_confidence": 0.99,
    "verified_by_human": false
  }
]
