[
  {
    "evidence_id": "10_1016_j_matdes_2019_108076-d5-bcc-ev-001",
    "sample_id": "10_1016_j_matdes_2019_108076-d5-bcc",
    "field_name": "raw_structure",
    "field_value": "BCC",
    "source_priority": "T1",
    "source_type": "text",
    "page_no": 2,
    "figure_id": null,
    "table_id": null,
    "text_snippet": "Recently, the research on metal three-dimensional lattice structure mainly focuses on body-centered cubic (BCC) and other topologies derived from it.",
    "extractor": "build_pdf_sample_bundle",
    "extract_confidence": 0.98,
    "verified_by_human": false
  },
  {
    "evidence_id": "10_1016_j_matdes_2019_108076-d5-bcc-ev-002",
    "sample_id": "10_1016_j_matdes_2019_108076-d5-bcc",
    "field_name": "raw_design",
    "field_value": "25 × 25 × 25 mm cube, BCC lattice",
    "source_priority": "T1",
    "source_type": "text",
    "page_no": 3,
    "figure_id": null,
    "table_id": null,
    "text_snippet": "AutoCAD software was used to design the lattice structures in cubes of dimensions 25 × 25 × 25 mm so that they could be built in one batch to reduce production deviation.",
    "extractor": "build_pdf_sample_bundle",
    "extract_confidence": 0.98,
    "verified_by_human": false
  },
  {
    "evidence_id": "10_1016_j_matdes_2019_108076-d5-bcc-ev-003",
    "sample_id": "10_1016_j_matdes_2019_108076-d5-bcc",
    "field_name": "raw_material",
    "field_value": "316L stainless steel",
    "source_priority": "T1",
    "source_type": "text",
    "page_no": 3,
    "figure_id": null,
    "table_id": null,
    "text_snippet": "All of the lattice structures were made from a 316L stainless steel powder with an average particle size of 35 ± 10 µm.",
    "extractor": "build_pdf_sample_bundle",
    "extract_confidence": 0.99,
    "verified_by_human": false
  },
  {
    "evidence_id": "10_1016_j_matdes_2019_108076-d5-bcc-ev-004",
    "sample_id": "10_1016_j_matdes_2019_108076-d5-bcc",
    "field_name": "raw_process",
    "field_value": "SLM",
    "source_priority": "T1",
    "source_type": "text",
    "page_no": 3,
    "figure_id": null,
    "table_id": null,
    "text_snippet": "SLM technique as the additive manufacturing process was used to fabricate lattice structures.",
    "extractor": "build_pdf_sample_bundle",
    "extract_confidence": 0.99,
    "verified_by_human": false
  },
  {
    "evidence_id": "10_1016_j_matdes_2019_108076-d5-bcc-ev-005",
    "sample_id": "10_1016_j_matdes_2019_108076-d5-bcc",
    "field_name": "relative_density_raw",
    "field_value": "12.60%",
    "source_priority": "T1",
    "source_type": "table",
    "page_no": 4,
    "figure_id": null,
    "table_id": "table_002",
    "text_snippet": "Table 2 The parameters of design configuration for lattice structure. Lattice structure D (mm) P (%) 1 1 12.60 12.60 Sample designation C1 C2 C3 C4 C5 C6 C7 D1 D2 D3 D4 D5 D6 D7 D8 LED (J/mm 3 ) 109.7 89.29 71.43 71.23 49.02 39.22 29.41 23.81",
    "extractor": "build_pdf_sample_bundle",
    "extract_confidence": 0.98,
    "verified_by_human": false
  },
  {
    "evidence_id": "10_1016_j_matdes_2019_108076-d5-bcc-ev-006",
    "sample_id": "10_1016_j_matdes_2019_108076-d5-bcc",
    "field_name": "velocity_m_s_raw",
    "field_value": "6 mm/min",
    "source_priority": "T1",
    "source_type": "text",
    "page_no": 4,
    "figure_id": null,
    "table_id": null,
    "text_snippet": "Uni-axial compression and tensile tests were carried out to assess the mechanical properties and energy absorption of the lattice structures by using a universal testing machine. During the compression tests, the lattice structures were centrally located between two plates. The speed of loading was set a constant of 6 mm/min for all of the tests.",
    "extractor": "build_pdf_sample_bundle",
    "extract_confidence": 0.99,
    "verified_by_human": false
  },
  {
    "evidence_id": "10_1016_j_matdes_2019_108076-d5-bcc-ev-007",
    "sample_id": "10_1016_j_matdes_2019_108076-d5-bcc",
    "field_name": "sea_j_g",
    "field_value": "1.09 J/g",
    "source_priority": "T1",
    "source_type": "table",
    "page_no": 7,
    "figure_id": null,
    "table_id": "table_005",
    "text_snippet": "Table 5 Energy absorption of the lattices derived from the stress-strain diagrams. Lattice designation Plateau stress, σ pl (MPa) Strain at the plateau start, ε y At the plateau end Strain, ε cd Energy absorbed, W (J/cm 3 ) Efficiency, E (%) A2 79.67 0.06 0.41 31.28 35.20 B1 8.99 0.11 0.64 5.49 46.95 C4 6.35 0.07 0.56 3.36 45.94 D5 2.04 0.07 0.56 1.08 42.63",
    "extractor": "build_pdf_sample_bundle",
    "extract_confidence": 0.97,
    "verified_by_human": false
  },
  {
    "evidence_id": "10_1016_j_matdes_2019_108076-d5-bcc-ev-008",
    "sample_id": "10_1016_j_matdes_2019_108076-d5-bcc",
    "field_name": "plateau_stress_mpa",
    "field_value": "2.04 MPa",
    "source_priority": "T1",
    "source_type": "table",
    "page_no": 7,
    "figure_id": null,
    "table_id": "table_005",
    "text_snippet": "Table 5 Energy absorption of the lattices derived from the stress-strain diagrams. Lattice designation Plateau stress, σ pl (MPa) Strain at the plateau start, ε y At the plateau end Strain, ε cd Energy absorbed, W (J/cm 3 ) Efficiency, E (%) A2 79.67 0.06 0.41 31.28 35.20 B1 8.99 0.11 0.64 5.49 46.95 C4 6.35 0.07 0.56 3.36 45.94 D5 2.04 0.07 0.56 1.08 42.63",
    "extractor": "build_pdf_sample_bundle",
    "extract_confidence": 0.97,
    "verified_by_human": false
  }
]
