[
  {
    "evidence_id": "10_1016_j_jmrt_2021_08_092-radial-hybrid-r016-ev-001",
    "sample_id": "10_1016_j_jmrt_2021_08_092-radial-hybrid-r016",
    "field_name": "raw_structure",
    "field_value": "Diamond/Gyroid hybrid TPMS lattice",
    "source_priority": "T1",
    "source_type": "text",
    "page_no": 1,
    "figure_id": null,
    "table_id": null,
    "text_snippet": "Abstract states the work investigates hybrid cellular structures comprised of Gyroid and Diamond unit cells hybridised linearly and radially.",
    "extractor": "build_pdf_sample_bundle",
    "extract_confidence": 0.99,
    "verified_by_human": false
  },
  {
    "evidence_id": "10_1016_j_jmrt_2021_08_092-radial-hybrid-r016-ev-002",
    "sample_id": "10_1016_j_jmrt_2021_08_092-radial-hybrid-r016",
    "field_name": "raw_design",
    "field_value": "radial hybrid",
    "source_priority": "T1",
    "source_type": "figure",
    "page_no": 3,
    "figure_id": "fig_006",
    "table_id": null,
    "text_snippet": "Fig. 2 shows the computer model and fabricated specimens of the longitudinal and radial hybrid TPMS lattices.",
    "extractor": "build_pdf_sample_bundle",
    "extract_confidence": 0.99,
    "verified_by_human": false
  },
  {
    "evidence_id": "10_1016_j_jmrt_2021_08_092-radial-hybrid-r016-ev-003",
    "sample_id": "10_1016_j_jmrt_2021_08_092-radial-hybrid-r016",
    "field_name": "raw_material",
    "field_value": "316L stainless steel",
    "source_priority": "T1",
    "source_type": "text",
    "page_no": 3,
    "figure_id": null,
    "table_id": null,
    "text_snippet": "Gas atomised stainless steel 316L powder was used to fabricate the plate samples with consistent and repeatable geometry.",
    "extractor": "build_pdf_sample_bundle",
    "extract_confidence": 0.99,
    "verified_by_human": false
  },
  {
    "evidence_id": "10_1016_j_jmrt_2021_08_092-radial-hybrid-r016-ev-004",
    "sample_id": "10_1016_j_jmrt_2021_08_092-radial-hybrid-r016",
    "field_name": "raw_process",
    "field_value": "LPBF",
    "source_priority": "T1",
    "source_type": "text",
    "page_no": 3,
    "figure_id": null,
    "table_id": null,
    "text_snippet": "The generated lattices were fabricated using the powder bed fusion system EOS M280.",
    "extractor": "build_pdf_sample_bundle",
    "extract_confidence": 0.98,
    "verified_by_human": false
  },
  {
    "evidence_id": "10_1016_j_jmrt_2021_08_092-radial-hybrid-r016-ev-005",
    "sample_id": "10_1016_j_jmrt_2021_08_092-radial-hybrid-r016",
    "field_name": "relative_density_value",
    "field_value": "0.16",
    "source_priority": "T1",
    "source_type": "text",
    "page_no": 3,
    "figure_id": null,
    "table_id": null,
    "text_snippet": "The fabricated sample plates were cut from the as-built plates and the actual relative densities were calculated in the range of 15% to 21.9%.",
    "extractor": "build_pdf_sample_bundle",
    "extract_confidence": 0.98,
    "verified_by_human": false
  },
  {
    "evidence_id": "10_1016_j_jmrt_2021_08_092-radial-hybrid-r016-ev-006",
    "sample_id": "10_1016_j_jmrt_2021_08_092-radial-hybrid-r016",
    "field_name": "velocity_m_s_raw",
    "field_value": "0.1 mm/s",
    "source_priority": "T1",
    "source_type": "text",
    "page_no": 3,
    "figure_id": null,
    "table_id": null,
    "text_snippet": "Uniaxial compression tests following ISO 13314:2011 were performed on an INSTRON 8801 testing machine with the position-controlled cross-head rate of 0.1 mm/s.",
    "extractor": "build_pdf_sample_bundle",
    "extract_confidence": 0.99,
    "verified_by_human": false
  },
  {
    "evidence_id": "10_1016_j_jmrt_2021_08_092-radial-hybrid-r016-ev-007",
    "sample_id": "10_1016_j_jmrt_2021_08_092-radial-hybrid-r016",
    "field_name": "plateau_stress_mpa",
    "field_value": "33.53 MPa",
    "source_priority": "T1",
    "source_type": "table",
    "page_no": 7,
    "figure_id": null,
    "table_id": "table_003",
    "text_snippet": "Table 3 records plateau stress 33.53 MPa and SEA 9.96 J/g for the radial hybrid lattice with 16% relative density.",
    "extractor": "build_pdf_sample_bundle",
    "extract_confidence": 0.99,
    "verified_by_human": false
  },
  {
    "evidence_id": "10_1016_j_jmrt_2021_08_092-radial-hybrid-r016-ev-008",
    "sample_id": "10_1016_j_jmrt_2021_08_092-radial-hybrid-r016",
    "field_name": "sea_j_g",
    "field_value": "9.96 J/g",
    "source_priority": "T1",
    "source_type": "table",
    "page_no": 7,
    "figure_id": null,
    "table_id": "table_003",
    "text_snippet": "Table 3 records plateau stress 33.53 MPa and SEA 9.96 J/g for the radial hybrid lattice with 16% relative density.",
    "extractor": "build_pdf_sample_bundle",
    "extract_confidence": 0.99,
    "verified_by_human": false
  }
]
