[
  {
    "evidence_id": "pii_s0734_743x_97_00040_7-al-honeycomb-ev-001",
    "sample_id": "pii_s0734_743x_97_00040_7-al-honeycomb",
    "field_name": "raw_structure",
    "field_value": "aluminum honeycomb",
    "source_priority": "T1",
    "source_type": "text",
    "page_no": 2,
    "figure_id": null,
    "table_id": null,
    "text_snippet": "The materials investigated were an aluminum honeycomb (referred to as al-honeycomb in the future) and a stainless-steel honeycomb (ss-honeycomb).",
    "extractor": "build_pdf_sample_bundle",
    "extract_confidence": 0.99,
    "verified_by_human": false
  },
  {
    "evidence_id": "pii_s0734_743x_97_00040_7-al-honeycomb-ev-002",
    "sample_id": "pii_s0734_743x_97_00040_7-al-honeycomb",
    "field_name": "raw_design",
    "field_value": "76.2 mm long al-honeycomb specimen, 50.8 mm maximum diameter",
    "source_priority": "T1",
    "source_type": "text",
    "page_no": 3,
    "figure_id": null,
    "table_id": null,
    "text_snippet": "In this series of tests, the specimens to be tested at high rates of loading could have a maximum diameter of 50.8 mm (2 in) because of constraints imposed by the dynamic test hardware. The maximum length was limited to 76.2 mm (3 in) by the stock size.",
    "extractor": "build_pdf_sample_bundle",
    "extract_confidence": 0.99,
    "verified_by_human": false
  },
  {
    "evidence_id": "pii_s0734_743x_97_00040_7-al-honeycomb-ev-003",
    "sample_id": "pii_s0734_743x_97_00040_7-al-honeycomb",
    "field_name": "raw_material",
    "field_value": "5052 aluminum",
    "source_priority": "T1",
    "source_type": "text",
    "page_no": 2,
    "figure_id": null,
    "table_id": null,
    "text_snippet": "The al-honeycomb was made of 0.1905 mm (0.0075 in) thick sheets of 5052 aluminum, and it had an overall density was 881 kg/m3 (55 lb/ft3).",
    "extractor": "build_pdf_sample_bundle",
    "extract_confidence": 0.99,
    "verified_by_human": false
  },
  {
    "evidence_id": "pii_s0734_743x_97_00040_7-al-honeycomb-ev-004",
    "sample_id": "pii_s0734_743x_97_00040_7-al-honeycomb",
    "field_name": "raw_process",
    "field_value": "furnace-brazed",
    "source_priority": "T1",
    "source_type": "text",
    "page_no": 3,
    "figure_id": null,
    "table_id": null,
    "text_snippet": "furnace-brazed together. Measurements on the material showed that the forming process for the half-hexagon cell sheets reduced the thickness at the bends to about 0.30 mm (0.012 in).",
    "extractor": "build_pdf_sample_bundle",
    "extract_confidence": 0.99,
    "verified_by_human": false
  },
  {
    "evidence_id": "pii_s0734_743x_97_00040_7-al-honeycomb-ev-005",
    "sample_id": "pii_s0734_743x_97_00040_7-al-honeycomb",
    "field_name": "test_mode",
    "field_value": "quasi_static",
    "source_priority": "T1",
    "source_type": "text",
    "page_no": 5,
    "figure_id": null,
    "table_id": null,
    "text_snippet": "The quasi-static tests were conducted on a 1.8 MN (400,000 lb) capacity Tinius-Olsen testing machine using a compression rate of approximately 0.025 mm/s (0.001 in/s) for the 76.2 mm (3 in) long specimen.",
    "extractor": "build_pdf_sample_bundle",
    "extract_confidence": 0.99,
    "verified_by_human": false
  },
  {
    "evidence_id": "pii_s0734_743x_97_00040_7-al-honeycomb-ev-006",
    "sample_id": "pii_s0734_743x_97_00040_7-al-honeycomb",
    "field_name": "velocity_m_s_raw",
    "field_value": "0.025 mm/s",
    "source_priority": "T1",
    "source_type": "text",
    "page_no": 5,
    "figure_id": null,
    "table_id": null,
    "text_snippet": "The quasi-static tests were conducted on a 1.8 MN (400,000 lb) capacity Tinius-Olsen testing machine using a compression rate of approximately 0.025 mm/s (0.001 in/s) for the 76.2 mm (3 in) long specimen.",
    "extractor": "build_pdf_sample_bundle",
    "extract_confidence": 0.99,
    "verified_by_human": false
  },
  {
    "evidence_id": "pii_s0734_743x_97_00040_7-al-honeycomb-ev-007",
    "sample_id": "pii_s0734_743x_97_00040_7-al-honeycomb",
    "field_name": "relative_density_raw",
    "field_value": "32 % of solid aluminum",
    "source_priority": "T1",
    "source_type": "text",
    "page_no": 13,
    "figure_id": null,
    "table_id": null,
    "text_snippet": "A method has been developed for measuring the mechanical properties of high-density metal honeycombs at initial strain rates up to 2000/s under conditions approximating one-dimensional strain. The method has been used for testing an aluminum honeycomb having a density ratio 32%, of that of solid aluminum.",
    "extractor": "build_pdf_sample_bundle",
    "extract_confidence": 0.99,
    "verified_by_human": false
  }
]
