[
  {
    "evidence_id": "10_1016_j_compstruct_2019_111219-psh-a5-b1p568-t0p3-ev-001",
    "sample_id": "10_1016_j_compstruct_2019_111219-psh-a5-b1p568-t0p3",
    "field_name": "raw_structure",
    "field_value": "petal-shaped honeycomb",
    "source_priority": "T1",
    "source_type": "text",
    "page_no": 1,
    "figure_id": null,
    "table_id": null,
    "text_snippet": "A novel circular-celled honeycomb was proposed by incorporating the petal-shaped mesostructures into the regular circular cell honeycomb.",
    "extractor": "build_pdf_sample_bundle",
    "extract_confidence": 1.0,
    "verified_by_human": false
  },
  {
    "evidence_id": "10_1016_j_compstruct_2019_111219-psh-a5-b1p568-t0p3-ev-002",
    "sample_id": "10_1016_j_compstruct_2019_111219-psh-a5-b1p568-t0p3",
    "field_name": "raw_process",
    "field_value": "LS-DYNA",
    "source_priority": "T1",
    "source_type": "text",
    "page_no": 3,
    "figure_id": null,
    "table_id": null,
    "text_snippet": "The PSH honeycomb specimen is made of aluminum alloy, and the nonlinear explicit FE code LS-DYNA is used to simulate the dynamic in-plane crushing response of PSH.",
    "extractor": "build_pdf_sample_bundle",
    "extract_confidence": 0.98,
    "verified_by_human": false
  },
  {
    "evidence_id": "10_1016_j_compstruct_2019_111219-psh-a5-b1p568-t0p3-ev-003",
    "sample_id": "10_1016_j_compstruct_2019_111219-psh-a5-b1p568-t0p3",
    "field_name": "sea_j_g",
    "field_value": "4.12808",
    "source_priority": "T1",
    "source_type": "table",
    "page_no": 6,
    "figure_id": null,
    "table_id": "table_001",
    "text_snippet": "Table 1 SEA of the three types of honeycombs under di ff erent impact velocities. Impact velocity (m/s) CCH (J/g) SPH (J/g) PSH (J/g) Increase compare with CCH 1 2.40983 2.43495 4.12808 71.3% 35 3.06404 3.12013 5.52834 80.4% 200 40.79576 41.00365 42.7685 4.83%",
    "extractor": "build_pdf_sample_bundle",
    "extract_confidence": 0.99,
    "verified_by_human": false
  },
  {
    "evidence_id": "10_1016_j_compstruct_2019_111219-psh-a5-b1p568-t0p3-ev-004",
    "sample_id": "10_1016_j_compstruct_2019_111219-psh-a5-b1p568-t0p3",
    "field_name": "plateau_stress_mpa",
    "field_value": "4.568",
    "source_priority": "T1",
    "source_type": "table",
    "page_no": 8,
    "figure_id": null,
    "table_id": "table_002",
    "text_snippet": "Table 2 Plateau stress of PSH under in-plane impact loading. t (mm) Impact velocity (m/s) 1 20 50 70 100 125 150 175 0.05 0.034 0.053 0.161 0.288 0.565 0.874 1.252 1.755 0.07 0.073 0.121 0.248 0.433 0.835 1.259 1.843 2.497 0.1 0.169 0.290 0.417 0.677 1.286 1.878 2.644 3.452 0.15 0.586 0.682 0.870 1.245 2.163 3.060 4.454 5.483 0.2 1.879 2.654 3.058 3.743 6.058 8.729 11.651 14.711 0.25 3.496 3.970 4.545 5.479 8.277 10.801 15.032 19.281 0.3 4.568 5.317 6.112 7.277 10.619 14.327 18.465 24.091",
    "extractor": "build_pdf_sample_bundle",
    "extract_confidence": 0.99,
    "verified_by_human": false
  }
]
